# Tests for the periodic-refresh trigger on batch-refresh materialized views.
#
# After the `refresh.interval.sec` elapses, a periodic refresh run should
# consume upstream changes and surface them in the batch-refresh MV.

statement ok
SET RW_IMPLICIT_FLUSH TO true;

statement ok
DROP MATERIALIZED VIEW IF EXISTS mv_batch;

statement ok
DROP MATERIALIZED VIEW IF EXISTS mv_up;

statement ok
DROP TABLE IF EXISTS t_batch;

statement ok
CREATE TABLE t_batch (v1 int);

statement ok
INSERT INTO t_batch VALUES (1), (2);

statement ok
CREATE MATERIALIZED VIEW mv_up AS SELECT * FROM t_batch;

query I rowsort retry 60 backoff 1s
SELECT * FROM mv_up;
----
1
2

statement ok
CREATE MATERIALIZED VIEW mv_batch WITH (refresh.interval.sec = 3) AS
SELECT * FROM mv_up;

# Initial snapshot.
query I rowsort retry 60 backoff 1s
SELECT * FROM mv_batch;
----
1
2

# ─── first periodic refresh picks up new upstream rows ───────────────────────

statement ok
INSERT INTO t_batch VALUES (3), (4);

statement ok
FLUSH;

query I rowsort retry 5 backoff 1s
SELECT * FROM mv_up;
----
1
2
3
4

# Wait for at least one refresh cycle to kick in and complete. A cycle starts only
# once the committed epoch passes the interval, which can lag by over 10s on a
# loaded cluster.
query I rowsort retry 30 backoff 2s
SELECT * FROM mv_batch;
----
1
2
3
4

# ─── second periodic refresh picks up further changes (incl. deletes) ────────

statement ok
DELETE FROM t_batch WHERE v1 = 1;

statement ok
INSERT INTO t_batch VALUES (5);

statement ok
FLUSH;

query I rowsort retry 5 backoff 1s
SELECT * FROM mv_up;
----
2
3
4
5

query I rowsort retry 30 backoff 2s
SELECT * FROM mv_batch;
----
2
3
4
5

statement ok
DROP MATERIALIZED VIEW mv_batch;

statement ok
DROP MATERIALIZED VIEW mv_up;

statement ok
DROP TABLE t_batch;
