statement ok
SET RW_IMPLICIT_FLUSH TO true;

statement ok
create table t1 (v1 int, v2 int, v3 int, primary key(v1)) APPEND ONLYon conflict ignore;

statement ok
insert into t1 values (1,4,2), (2,3,3);

statement ok
insert into t1 values (3,4,5), (3,6,7);

statement ok
insert into t1 values (1,5,3);

statement ok
create materialized view mv1 as select * from t1;

query I rowsort
select v1, v2, v3 from mv1;
----
1 4 2
2 3 3
3 4 5

statement ok
SET RW_IMPLICIT_FLUSH TO true;

statement error
create table t2 (v1 int, v2 int, v3 int, primary key(v1)) APPEND ONLY on conflict overwrite;

statement ok
create table t2 (v1 int, v2 int, v3 int, primary key(v1)) on conflict overwrite;

statement ok
insert into t2 values (1,4,2), (2,3,3);

statement ok
insert into t2 values (3,4,5), (3,6,7);

statement ok
insert into t2 values (1,5,3);

statement ok
create materialized view mv2 as select * from t2;

query II rowsort
select v1, v2, v3 from mv2;
----
1 5 3
2 3 3
3 6 7

statement ok
drop materialized view mv1;

statement ok
drop materialized view mv2;

statement ok
drop table t1;

statement ok
drop table t2;


statement ok
SET RW_IMPLICIT_FLUSH TO true;

statement ok
create table t3 (v1 int, v2 int, v3 int, primary key(v1)) on conflict do update if not null;

statement ok
insert into t3 values (1,null,2), (2,3,null);

statement ok
insert into t3 values (3,null,5), (3,6,null);

statement ok
insert into t3 values (1,5,null), (2,null,null);

statement ok
create materialized view mv3 as select * from t3;


query III rowsort
select v1, v2, v3 from mv3;
----
1 5 2
2 3 NULL
3 6 5


statement ok
update t3 set v2 = 2 where v1 > 1;

statement ok
flush;

query IIII rowsort
select v1, v2, v3 from mv3;
----
1 5 2
2 2 NULL
3 2 5

statement ok
drop materialized view mv3;

statement ok
drop table t3;