statement ok
SET RW_IMPLICIT_FLUSH TO true;

statement ok
create table t(x int[]);

statement ok
insert into t values (Array[1,2]), (Array[1,NULL]), (Array[3,4,5]), (NULL);

statement ok
create materialized view mv as select unnest(x) as unnest, x from t;

query I rowsort
select unnest, x from mv;
----
1	{1,2}
1	{1,NULL}
2	{1,2}
3	{3,4,5}
4	{3,4,5}
5	{3,4,5}
NULL	{1,NULL}

statement ok
drop materialized view mv;

statement ok
drop table t;

statement ok
create table tweet(text VARCHAR);

statement ok
insert into tweet values ('#1 #2 abaaba'), ('ss #1 ggg #risingwave');

statement ok
create materialized view mv as
    with tags as (select unnest(regexp_matches(text, '#\w+', 'g')) as tag, text from tweet)
    select tag, count(*) as cnt from tags group by tag;

query TI rowsort
select * from mv;
----
#1          2
#2          1
#risingwave 1

statement ok
drop materialized view mv;

statement ok
drop table tweet;

# Test ProjectSet can handle Update Op.

statement ok
create table t(c int);

# When inserting into t, mv1 will trigger updates.
statement ok
create materialized view mv1 as select array_agg(c) as res from t;

statement ok
create materialized view mv2 as select unnest(res) as u from mv1;

statement ok
create materialized view mv3 as select * from (select unnest(res) as u from mv1) where u>2;

statement ok
insert into t values (1),(3);

statement ok
insert into t values (2),(4);

query I rowsort
select * from mv2;
----
1
2
3
4

query I rowsort
select * from mv3;
----
3
4

statement ok
drop materialized view mv3;

statement ok
drop materialized view mv2;

statement ok
drop materialized view mv1;

statement ok
drop table t;

# table functions should not be pruned
query I
with cte as (SELECT 1 as v1, unnest(array[1,2,3,4,5]) AS v2) select v1 from cte;
----
1
1
1
1
1

statement ok
create table t(arr varchar[]);

statement ok
create materialized view mv as select * from t cross join unnest(t.arr) WITH ORDINALITY AS x(elts, num);

statement ok
insert into t values (Array['a','b', 'c']), (Array['d','e']);

query I rowsort
select * from mv;
----
{a,b,c} a 1
{a,b,c} b 2
{a,b,c} c 3
{d,e}   d 1
{d,e}   e 2

statement ok
update t set arr = Array['a', 'c'] where arr = Array['a','b', 'c'];

query I rowsort
select * from mv;
----
{a,c} a 1
{a,c} c 2
{d,e} d 1
{d,e} e 2

statement ok
drop materialized view mv;

statement ok
drop table t;
