statement ok
SET RW_IMPLICIT_FLUSH TO true;

statement ok
create table t1 (v1 int, v2 int);

statement ok
create table t2 (v1 int, v3 int);

statement ok
create materialized view v as select * from t1 union all select * from t2;

statement ok
create materialized view v2 as select * from t1 union select * from t2;

query II
select * from v;
----

query II
select * from v2;
----

statement ok
insert into t1 values(1, 2);

query II
select * from v;
----
1 2

query II
select * from v2;
----
1 2

statement ok
insert into t2 values(1, 2);


query II
select * from v;
----
1 2
1 2

query II
select * from v2;
----
1 2

statement ok
delete from t1 where v1 = 1;

query II
select * from v;
----
1 2

query II
select * from v2;
----
1 2

statement ok
delete from t2 where v1 = 1;

query II
select * from v;
----

query II
select * from v2;
----


statement ok
drop materialized view v;

statement ok
drop materialized view v2;

statement ok
drop table t1;

statement ok
drop table t2;
