statement ok
create table t (v1 int not null, v2 int not null);

# Insert

statement ok
insert into t values (114, 10), (514, 20);

statement ok
flush;

query RI
select v1, v2 from t order by v2;
----
114 10
514 20

statement ok
insert into t values (810, 40), (1919, 30);

statement ok
flush;

query RI
select v1, v2 from t order by v2;
----
114 10
514 20
1919 30
810 40

# Delete

statement ok
delete from t where v1 = 1919;

statement ok
flush;

query RI
select v1, v2 from t order by v2;
----
114 10
514 20
810 40

# query I
# select count(*) from t;
# ----
# 3

statement ok
delete from t;

statement ok
flush;

query RI
select v1, v2 from t order by v2;
----

# query I
# select count(*) from t;
# ----
# 0

statement ok
drop table t;
