statement ok
SET RW_IMPLICIT_FLUSH TO true;

# currently, we only support single sink into table

statement ok
create table t_simple (v1 int, v2 int);

statement ok
create table m_simple (v1 int primary key, v2 int);

statement ok
create sink s_simple_1 into m_simple as select v1, v2 from t_simple;

statement error Create sink into table with incoming sinks has not been implemented.
create sink s_simple_2 into m_simple as select v1, v2 from t_simple;

# and we can't alter a table with incoming sinks
statement error Alter a table with incoming sinks has not been implemented.
alter table m_simple add column v3 int;

statement ok
drop sink s_simple_1;

statement ok
drop table t_simple;

statement ok
drop table m_simple;

# target table with row_id as primary key
statement ok
create table t_s1 (v1 int, v2 int);

statement ok
insert into t_s1 values (1, 11), (2, 12), (3, 13);

statement ok
create table t_row_id_as_primary_key (v1 int, v2 int, v3 int, v4 int as v1 + v2);

statement error Only append-only sinks can sink to a table without primary keys.
create sink s1 into t_row_id_as_primary_key as select v1, v2 from t_s1;

statement ok
create sink s1 into t_row_id_as_primary_key as select v1, v2 from t_s1 with (type = 'append-only', force_append_only = 'true');

statement ok
flush;

query IIII rowsort
select * from t_row_id_as_primary_key;
----
1 11 NULL 12
2 12 NULL 14
3 13 NULL 16

statement ok
insert into t_s1 values (4, 14), (5, 15), (6, 16);

query IIII rowsort
select * from t_row_id_as_primary_key;
----
1 11 NULL 12
2 12 NULL 14
3 13 NULL 16
4 14 NULL 18
5 15 NULL 20
6 16 NULL 22

statement ok
insert into t_row_id_as_primary_key values (100, 100);

query IIII
select * from t_row_id_as_primary_key order by v1;
----
1 11 NULL 12
2 12 NULL 14
3 13 NULL 16
4 14 NULL 18
5 15 NULL 20
6 16 NULL 22
100 100 NULL 200

# test append only
statement ok
update t_s1 set v2 = 10 where v1 > 3;

query IIII
select * from t_row_id_as_primary_key order by v1, v2;
----
1 11 NULL 12
2 12 NULL 14
3 13 NULL 16
4 10 NULL 14
4 14 NULL 18
5 10 NULL 15
5 15 NULL 20
6 10 NULL 16
6 16 NULL 22
100 100 NULL 200

statement ok
delete from t_s1;

query IIII
select * from t_row_id_as_primary_key order by v1,v2;
----
1 11 NULL 12
2 12 NULL 14
3 13 NULL 16
4 10 NULL 14
4 14 NULL 18
5 10 NULL 15
5 15 NULL 20
6 10 NULL 16
6 16 NULL 22
100 100 NULL 200

statement ok
drop sink s1;

statement ok
drop table t_row_id_as_primary_key;

statement ok
drop table t_s1;


# target table with append only

statement ok
create table t_s2 (v1 int, v2 int);

statement ok
insert into t_s2 values (1, 11), (2, 12), (3, 13);

statement ok
create table t_append_only (v1 int, v2 int, v3 int, v4 int as v1 + v2) append only;

statement error Only append-only sinks can sink to a table without primary keys.
create sink s2 into t_append_only as select v1, v2 from t_s2;

statement ok
create sink s2 into t_append_only as select v1, v2 from t_s2 with (type = 'append-only', force_append_only = 'true');

statement ok
flush;

query IIII rowsort
select * from t_append_only;
----
1 11 NULL 12
2 12 NULL 14
3 13 NULL 16

statement ok
insert into t_s2 values (4, 14), (5, 15), (6, 16);

query IIII rowsort
select * from t_append_only;
----
1 11 NULL 12
2 12 NULL 14
3 13 NULL 16
4 14 NULL 18
5 15 NULL 20
6 16 NULL 22

statement ok
insert into t_append_only values (100, 100);

query IIII
select * from t_append_only order by v1;
----
1 11 NULL 12
2 12 NULL 14
3 13 NULL 16
4 14 NULL 18
5 15 NULL 20
6 16 NULL 22
100 100 NULL 200

# test append only
statement ok
update t_s2 set v2 = 10 where v1 > 3;

query IIII
select * from t_append_only order by v1, v2;
----
1 11 NULL 12
2 12 NULL 14
3 13 NULL 16
4 10 NULL 14
4 14 NULL 18
5 10 NULL 15
5 15 NULL 20
6 10 NULL 16
6 16 NULL 22
100 100 NULL 200

statement ok
delete from t_s2;

query IIII
select * from t_append_only order by v1,v2;
----
1 11 NULL 12
2 12 NULL 14
3 13 NULL 16
4 10 NULL 14
4 14 NULL 18
5 10 NULL 15
5 15 NULL 20
6 10 NULL 16
6 16 NULL 22
100 100 NULL 200

statement ok
drop sink s2;

statement ok
drop table t_append_only;

statement ok
drop table t_s2;


# target table with primary key

statement ok
create table t_s3 (v1 int, v2 int);

statement ok
insert into t_s3 values (1, 11), (2, 12), (3, 13);

statement ok
create table t_primary_key (v1 int primary key, v2 int, v3 int, v4 int as v1 + v2);

statement ok
create sink s3 into t_primary_key as select v1, v2 from t_s3;

statement ok
flush;

query IIII rowsort
select * from t_primary_key;
----
1 11 NULL 12
2 12 NULL 14
3 13 NULL 16

statement ok
insert into t_s3 values (4, 14), (5, 15), (6, 16);

query IIII rowsort
select * from t_primary_key;
----
1 11 NULL 12
2 12 NULL 14
3 13 NULL 16
4 14 NULL 18
5 15 NULL 20
6 16 NULL 22

statement ok
delete from t_s3 where v1 > 3;

query I rowsort
select * from t_primary_key;
----
1 11 NULL 12
2 12 NULL 14
3 13 NULL 16

statement ok
update t_s3 set v2 = 111 where v1 = 1;

query I rowsort
select * from t_primary_key;
----
1 111 NULL 112
2 12 NULL 14
3 13 NULL 16

statement ok
insert into t_primary_key values (100, 100);

query IIII
select * from t_primary_key order by v1;
----
1 111 NULL 112
2 12 NULL 14
3 13 NULL 16
100 100 NULL 200

statement ok
delete from t_s3 where v1 > 3;

query IIII
select * from t_primary_key order by v1;
----
1 111 NULL 112
2 12 NULL 14
3 13 NULL 16
100 100 NULL 200




