# mysql

query I rowsort
SELECT * FROM mysql_table_in_rw;
----
1 11
2 22

system ok
mysql --host=mysql --port=3306 -u root -p123456 -D rwcdc << EOF
UPDATE table_in_mysql SET name='xxx' WHERE id=1;
EOF

sleep 3s

query II rowsort
SELECT * FROM mysql_table_in_rw;
----
1 xxx
2 22

# postgres

query I rowsort
SELECT * FROM postgres_table_in_rw;
----
1 11
2 22

system ok
PGHOST=db PGPORT=5432 PGUSER=postgres PGPASSWORD='post\tgres' PGDATABASE=rwcdc psql << EOF
UPDATE table_in_postgres SET name='xxx' WHERE id=1;
EOF

sleep 3s

query II rowsort
SELECT * FROM postgres_table_in_rw;
----
1 xxx
2 22

# sqlserver

query I rowsort
SELECT * FROM sqlserver_table_in_rw;
----
1 11
2 22

system ok
SQLCMDSERVER=sqlserver-server SQLCMDUSER=SA SQLCMDPASSWORD="SomeTestOnly@SA" SQLCMDDBNAME=rwcdc SQLCMDPORT=1433 sqlcmd <<EOF
UPDATE table_in_sqlserver SET name='xxx' WHERE id=1;
GO
EOF

sleep 5s

query II rowsort
SELECT * FROM sqlserver_table_in_rw;
----
1 xxx
2 22