# mysql

query I rowsort retry 10 backoff 3s
SELECT * FROM mysql_table_in_rw;
----
1 11
2 22

system ok
mysql --host=mysql --port=3306 -u root -p123456 -D rwcdc << EOF
UPDATE table_in_mysql SET name='xxx' WHERE id=1;
EOF

query II rowsort retry 10 backoff 3s
SELECT * FROM mysql_table_in_rw;
----
1 xxx
2 22

# postgres

query I rowsort retry 10 backoff 3s
SELECT * FROM postgres_table_in_rw;
----
1 11
2 22

system ok
PGHOST=db PGPORT=5432 PGUSER=postgres PGPASSWORD='post\tgres' PGDATABASE=rwcdc psql << EOF
UPDATE table_in_postgres SET name='xxx' WHERE id=1;
EOF

query II rowsort retry 10 backoff 3s
SELECT * FROM postgres_table_in_rw;
----
1 xxx
2 22
