# This file is generated by `gen.py`. Do not edit it manually!

# Test handling of updates having no effect on window function outputs.

statement ok
create table t (
      id int
    , foo int
    , bar int
);

statement ok
create view v1 as
select
    *
    , rank() over (partition by 1::int order by foo) as r1
from t;

statement ok
create view v2 as
select
    *
    , rank() over (partition by 1::int order by bar) as r2
from t;

statement ok
insert into t values
  (100001, 701, 805)
, (100002, 700, 806)
, (100003, 723, 807)
, (100004, 702, 808);

query iii
select * from v1 order by r1, id;
----
100002 700 806 1
100001 701 805 2
100004 702 808 3
100003 723 807 4

query iii
select * from v2 order by r2, id;
----
100001 701 805 1
100002 700 806 2
100003 723 807 3
100004 702 808 4

statement ok
update t set foo = 733 where id = 100001;

query iii
select * from v1 order by r1, id;
----
100002 700 806 1
100004 702 808 2
100003 723 807 3
100001 733 805 4

query iii
select * from v2 order by r2, id;
----
100001 733 805 1
100002 700 806 2
100003 723 807 3
100004 702 808 4

statement ok
update t set bar = 804 where id = 100001;

query iii
select * from v1 order by r1, id;
----
100002 700 806 1
100004 702 808 2
100003 723 807 3
100001 733 804 4

query iii
select * from v2 order by r2, id;
----
100001 733 804 1
100002 700 806 2
100003 723 807 3
100004 702 808 4

statement ok
drop view v1;

statement ok
drop view v2;

statement ok
drop table t;
