statement ok
SET RW_IMPLICIT_FLUSH TO true;

statement ok
CREATE TABLE t (field VARCHAR);

statement ok
INSERT INTO t VALUES
    ('microseconds'),
    ('milliseconds'),
    ('second'),
    ('minute'),
    ('hour'),
    ('day'),
    ('week'),
    ('month'),
    ('quarter'),
    ('year'),
    ('decade'),
    ('century'),
    ('millennium');

query T rowsort
SELECT field, date_trunc(field, TIMESTAMP '2202-02-16 20:38:40.123456') FROM t;
----
century	2201-01-01 00:00:00
day	2202-02-16 00:00:00
decade	2200-01-01 00:00:00
hour	2202-02-16 20:00:00
microseconds	2202-02-16 20:38:40.123456
millennium	2001-01-01 00:00:00
milliseconds	2202-02-16 20:38:40.123
minute	2202-02-16 20:38:00
month	2202-02-01 00:00:00
quarter	2202-01-01 00:00:00
second	2202-02-16 20:38:40
week	2202-02-15 00:00:00
year	2202-01-01 00:00:00

# invalid field
statement error
SELECT date_trunc('s', TIMESTAMP '2202-02-16 20:38:40.123456');

query T rowsort
SELECT field, date_trunc(field, TIMESTAMP WITH TIME ZONE '2202-02-16 20:38:40.123456Z', 'Australia/Sydney') FROM t;
----
century	2200-12-31 13:00:00+00:00
day	2202-02-16 13:00:00+00:00
decade	2199-12-31 13:00:00+00:00
hour	2202-02-16 20:00:00+00:00
microseconds	2202-02-16 20:38:40.123456+00:00
millennium	2000-12-31 13:00:00+00:00
milliseconds	2202-02-16 20:38:40.123+00:00
minute	2202-02-16 20:38:00+00:00
month	2202-01-31 13:00:00+00:00
quarter	2201-12-31 13:00:00+00:00
second	2202-02-16 20:38:40+00:00
week	2202-02-14 13:00:00+00:00
year	2201-12-31 13:00:00+00:00

statement ok
DELETE FROM t WHERE field = 'week';

# TODO: support us precision in interval
query T rowsort
SELECT field, date_trunc(field, INTERVAL '2333 year 4 months 5 days 02:47:33.123') FROM t;
----
century	2300 years
day	2333 years 4 mons 5 days
decade	2330 years
hour	2333 years 4 mons 5 days 02:00:00
microseconds	2333 years 4 mons 5 days 02:47:33.123
millennium	2000 years
milliseconds	2333 years 4 mons 5 days 02:47:33.123
minute	2333 years 4 mons 5 days 02:47:00
month	2333 years 4 mons
quarter	2333 years 3 mons
second	2333 years 4 mons 5 days 02:47:33
year	2333 years

# truncate 'week' is not supported for interval
statement error
SELECT date_trunc('week', INTERVAL '3 days 02:47:33');

statement ok
DROP TABLE t;
