control substitution on

system ok
mysql -u root --protocol='tcp' -e "
    SET GLOBAL time_zone = '+00:00';
"

system ok
mysql -u root --protocol='tcp' -e "
  DROP DATABASE IF EXISTS testdb1;
  CREATE DATABASE testdb1;
  USE testdb1;
  CREATE TABLE products (
      id INTEGER NOT NULL AUTO_INCREMENT PRIMARY KEY,
      name VARCHAR(255) NOT NULL,
      description VARCHAR(512)
  );
  ALTER TABLE products AUTO_INCREMENT = 101;
  INSERT INTO products
  VALUES (default,'scooter','Small 2-wheel scooter'),
         (default,'car battery','12V car battery'),
         (default,'12-pack drill','12-pack of drill bits with sizes ranging from #40 to #3'),
         (default,'hammer','12oz carpenter s hammer'),
         (default,'hammer','14oz carpenter s hammer'),
         (default,'hammer','16oz carpenter s hammer'),
         (default,'rocks','box of assorted rocks'),
         (default,'jacket','water resistent black wind breaker'),
         (default,'spare tire','24 inch spare tire');
  CREATE TABLE orders (
      order_id INTEGER NOT NULL AUTO_INCREMENT PRIMARY KEY,
      order_date DATETIME NOT NULL,
      customer_name VARCHAR(255) NOT NULL,
      price DECIMAL(10, 5) NOT NULL,
      product_id INTEGER NOT NULL,
      order_status BOOLEAN NOT NULL
  ) AUTO_INCREMENT = 10001;
  INSERT INTO orders
  VALUES (default, '2020-07-30 10:08:22', 'Jark', 50.50, 102, false),
         (default, '2020-07-30 10:11:09', 'Sally', 15.00, 105, false),
         (default, '2020-07-30 12:00:30', 'Edward', 25.25, 106, false);
"

statement ok
create source mysql_source with (
  connector = 'mysql-cdc',
  hostname = '${MYSQL_HOST:localhost}',
  port = '${MYSQL_TCP_PORT:8306}',
  username = 'root',
  password = '123456',
  database.name = 'testdb1',
  server.id = '5185'
);

statement ok
create table products_1 ( id INT,
 name STRING,
 description STRING,
 PRIMARY KEY (id)
) from mysql_source table 'testdb1.products';

statement ok
create table orders_1 (*) from mysql_source table 'testdb1.orders';

system ok
psql -c "
  DROP TABLE IF EXISTS shipments;
  CREATE TABLE shipments (
    shipment_id SERIAL NOT NULL PRIMARY KEY,
    order_id SERIAL NOT NULL,
    origin VARCHAR(255) NOT NULL,
    destination VARCHAR(255) NOT NULL,
    is_arrived BOOLEAN NOT NULL
  );
  ALTER SEQUENCE public.shipments_shipment_id_seq RESTART WITH 1001;
  INSERT INTO shipments
  VALUES (default,10001,'Beijing','Shanghai',false),
         (default,10002,'Hangzhou','Shanghai',false),
         (default,10003,'Shanghai','Hangzhou',false);
"

statement ok
create source pg_source with (
  connector = 'postgres-cdc',
  hostname = '${PGHOST:localhost}',
  port = '${PGPORT:5432}',
  username = '${PGUSER:$USER}',
  password = '${PGPASSWORD:}',
  database.name = '${PGDATABASE:postgres}',
  slot.name = 'cdc_alter_test'
);

statement ok
create table shipments_1 (
  shipment_id INTEGER,
  order_id INTEGER,
  origin STRING,
  destination STRING,
  is_arrived boolean,
 PRIMARY KEY (shipment_id)
) from pg_source table 'public.shipments';

# Create a mview join orders, products and shipments
statement ok
create materialized view enriched_orders as SELECT o.*, p.name, p.description, s.shipment_id, s.origin, s.destination, s.is_arrived
 FROM orders_1 AS o
 LEFT JOIN products_1 AS p ON o.product_id = p.id
 LEFT JOIN shipments_1 AS s ON o.order_id = s.order_id;


sleep 3s

query III
select order_id, product_id, shipment_id from enriched_orders order by order_id;
----
10001  102   1001
10002  105   1002
10003  106   1003


# alter mysql tables
system ok
mysql -u root --protocol='tcp' -e "
  USE testdb1;
  ALTER TABLE products ADD COLUMN weight DECIMAL(10, 2) NOT NULL DEFAULT 0.0;
  ALTER TABLE orders ADD COLUMN order_comment VARCHAR(255);
"

# alter cdc tables
statement ok
ALTER TABLE products_1 ADD COLUMN weight DECIMAL;

statement ok
ALTER TABLE orders_1 ADD COLUMN order_comment VARCHAR;

# wait alter ddl
sleep 3s

query ITTT
SELECT id,name,description,weight FROM products_1 order by id limit 3
----
101 scooter Small 2-wheel scooter NULL
102 car battery 12V car battery NULL
103 12-pack drill 12-pack of drill bits with sizes ranging from #40 to #3 NULL


# update mysql tables
system ok
mysql -u root --protocol='tcp' -e "
  USE testdb1;
  UPDATE products SET weight = 10.5 WHERE id = 101;
  UPDATE products SET weight = 12.5 WHERE id = 102;
  UPDATE orders SET order_comment = 'very good' WHERE order_id = 10001;
"

sleep 3s

query ITTT
SELECT id,name,description,weight FROM products_1 order by id limit 3
----
101 scooter Small 2-wheel scooter 10.50
102 car battery 12V car battery 12.50
103 12-pack drill 12-pack of drill bits with sizes ranging from #40 to #3 NULL

query ITTT
SELECT order_id,order_date,customer_name,product_id,order_status,order_comment FROM orders_1 order by order_id limit 2
----
10001 2020-07-30 10:08:22 Jark 102 0 very good
10002 2020-07-30 10:11:09 Sally 105 0 NULL


# alter mysql tables
system ok
mysql -u root --protocol='tcp' -e "
  USE testdb1;
  ALTER TABLE products DROP COLUMN weight;
"

# alter cdc table to drop column
statement ok
ALTER TABLE products_1 DROP COLUMN weight;

# wait alter ddl
sleep 3s

query TTTT
describe products_1;
----
id integer false NULL
name character varying false NULL
description character varying false NULL
primary key id NULL NULL
distribution key id NULL NULL
table description products_1 NULL NULL


# alter pg table
system ok
psql -c "
  ALTER TABLE shipments DROP COLUMN destination;
"

statement error
ALTER TABLE shipments_1 DROP COLUMN destination;

# wait alter ddl
sleep 3s

# query mv again
query III
select order_id, product_id, shipment_id from enriched_orders order by order_id;
----
10001  102   1001
10002  105   1002
10003  106   1003
