statement ok
create table t1 (k int primary key, ts timestamp);

statement ok
create materialized view mv as select * from hop(t1, ts, interval '10' minute, interval '30' minute);

statement ok
insert into t1 values (1, '2021-01-01 10:15:00');

statement ok
flush;

query ITTT rowsort
select * from mv;
----
1 2021-01-01 10:15:00 2021-01-01 09:50:00 2021-01-01 10:20:00
1 2021-01-01 10:15:00 2021-01-01 10:00:00 2021-01-01 10:30:00
1 2021-01-01 10:15:00 2021-01-01 10:10:00 2021-01-01 10:40:00

statement ok
update t1 set ts = '2021-01-01 10:25:00' where k = 1;

statement ok
flush;

query ITTT rowsort
select * from mv;
----
1 2021-01-01 10:25:00 2021-01-01 10:00:00 2021-01-01 10:30:00
1 2021-01-01 10:25:00 2021-01-01 10:10:00 2021-01-01 10:40:00
1 2021-01-01 10:25:00 2021-01-01 10:20:00 2021-01-01 10:50:00

statement ok
drop materialized view mv;

statement ok
drop table t1;
