statement ok
SET RW_IMPLICIT_FLUSH TO true;

statement ok
create table t(v int)

query RRRR
select stddev_pop(v), stddev_samp(v), var_pop(v), var_samp(v) from t
----
NULL NULL NULL NULL

statement ok
insert into t values (1)

query RRRR
select stddev_pop(v), stddev_samp(v), var_pop(v), var_samp(v) from t
----
0 NULL 0 NULL

statement ok
insert into t values (2), (3), (4), (5), (6)

query RRRR
select
	round(stddev_pop(v), 16),
	round(stddev_samp(v), 16),
	round(var_pop(v), 16),
	round(var_samp(v), 1)
from t
----
1.7078251276599331 1.8708286933869707 2.9166666666666667 3.5

statement ok
delete from t where v = 3

query RRRR
select
	round(stddev_pop(v), 16),
	round(stddev_samp(v), 16),
	round(var_pop(v), 2),
	round(var_samp(v), 1)
from t
----
1.8547236990991408 2.0736441353327721 3.44 4.3

statement ok
update t set v = 7 where v = 4

query RRRR
select
	round(stddev_pop(v), 16),
	round(stddev_samp(v), 16),
	round(var_pop(v), 2),
	round(var_samp(v), 1)
from t
----
2.3151673805580451 2.5884358211089569 5.36 6.7

statement ok
drop table t

statement ok
create table t(v int, w float);

query R
select stddev_samp(v) from t group by w;
----

statement ok
drop table t;
