# This file is generated by `gen.py`. Do not edit it manually!

# Test basic functionality of general batch and streaming over window.

include ./setup.slt.part

statement ok
insert into t values
  (100001, 100, 200, 1, 701, 805)
, (100002, 100, 200, 2, 700, 806)
, (100003, 100, 208, 2, 723, 807)
, (100004, 103, 200, 2, 702, 808);

query iiiiii
select * from v_a order by id;
----
100001  100  200  1  701  805  701
100002  100  200  2  700  806  701
100003  100  208  2  723  807  723
100004  103  200  2  702  808  702

query iiiiiiii
select * from v_b order by id;
----
100001  100  200  1  701  805  708   701  700
100002  100  200  2  700  806  708  1401  700
100003  100  208  2  723  807  708   723  723
100004  103  200  2  702  808  702   702  702

query iiiiiiiiii
select * from v_c order by id;
----
100001  100  200  1  701  805  701  NULL  NULL   806  NULL
100002  100  200  2  700  806  700   701   701  NULL  NULL
100003  100  208  2  723  807  723  NULL  NULL  NULL  NULL
100004  103  200  2  702  808  702  NULL  NULL  NULL  NULL

include ./cross_check.slt.part

statement ok
insert into t values
  (100005, 100, 200, 3, 717, 810)
, (100006, 105, 204, 5, 703, 828);

query iiiiii
select * from v_a order by id;
----
100001  100  200  1  701  805  701
100002  100  200  2  700  806  701
100003  100  208  2  723  807  723
100004  103  200  2  702  808  702
100005  100  200  3  717  810  701
100006  105  204  5  703  828  703

query iiiiiiii
select * from v_b order by id;
----
100001  100  200  1  701  805  710.25   701  700
100002  100  200  2  700  806  710.25  1401  700
100003  100  208  2  723  807  710.25   723  723
100004  103  200  2  702  808  702      702  702
100005  100  200  3  717  810  710.25  2118  717
100006  105  204  5  703  828  703      703  703

query iiiiiiiiii
select * from v_c order by id;
----
100001  100  200  1  701  805  701  NULL  NULL   806  NULL
100002  100  200  2  700  806  700   701   701   810   810
100003  100  208  2  723  807  723  NULL  NULL  NULL  NULL
100004  103  200  2  702  808  702  NULL  NULL  NULL  NULL
100005  100  200  3  717  810  717   700   700  NULL  NULL
100006  105  204  5  703  828  703  NULL  NULL  NULL  NULL

include ./cross_check.slt.part

statement ok
update t set v1 = 799 where id = 100002; -- value change

statement ok
update t set p2 = 200 where id = 100003; -- partition change

statement ok
update t set "time" = 1 where id = 100005; -- order change

query iiiiii
select * from v_a order by id;
----
100001  100  200  1  701  805  701
100002  100  200  2  799  806  701
100003  100  200  2  723  807  701
100004  103  200  2  702  808  702
100005  100  200  1  717  810  701
100006  105  204  5  703  828  703

query iiiiiiii
select * from v_b order by id;
----
100001  100  200  1  701  805  735   701  701
100002  100  200  2  799  806  735  2217  723
100003  100  200  2  723  807  735  2940  723
100004  103  200  2  702  808  702   702  702
100005  100  200  1  717  810  735  1418  717
100006  105  204  5  703  828  703   703  703

query iiiiiiiiii
select * from v_c order by id;
----
100001  100  200  1  701  805  701  NULL  NULL   810   807
100002  100  200  2  799  806  799   701   717   807  NULL
100003  100  200  2  723  807  723   799   799  NULL  NULL
100004  103  200  2  702  808  702  NULL  NULL  NULL  NULL
100005  100  200  1  717  810  717   723   701   806   806
100006  105  204  5  703  828  703  NULL  NULL  NULL  NULL

include ./cross_check.slt.part

statement ok
delete from t where time = 2;

query iiiiii
select * from v_a order by id;
----
100001  100  200  1  701  805  701
100005  100  200  1  717  810  701
100006  105  204  5  703  828  703

query iiiiiiii
select * from v_b order by id;
----
100001  100  200  1  701  805  709   701  701
100005  100  200  1  717  810  709  1418  717
100006  105  204  5  703  828  703   703  703

query iiiiiiiiii
select * from v_c order by id;
----
100001  100  200  1  701  805  701  NULL  NULL   810  NULL
100005  100  200  1  717  810  717   701   701  NULL  NULL
100006  105  204  5  703  828  703  NULL  NULL  NULL  NULL

include ./cross_check.slt.part

include ./teardown.slt.part
