statement ok
SET RW_IMPLICIT_FLUSH TO true;

# "nao" means non append only
# "npk" means no primary key

statement ok
create table t_nao_npk (k int, v1 int, v2 int);

statement ok
create table t_ao_npk (k int, v1 int, v2 int) APPEND ONLY;

statement ok
create table t_nao_pk (k int, v1 int, v2 int, primary key(k));

statement ok
create table t_ao_source (k int, v1 int, v2 int) APPEND ONLY;

statement ok
create table t_nao_source (k int, v1 int, v2 int);

# sinks to t_nao_npk
statement ok
create sink s1_to_t_nao_npk into t_nao_npk
as select k, v1, v2
from t_ao_source
with (
    type = 'append-only',
);

statement error Only append-only sinks can sink to a table without primary keys.
create sink s2_to_t_nao_npk into t_nao_npk
as select k, v1, v2
from t_nao_source;

statement ok
create sink s2_to_t_nao_npk into t_nao_npk
as select k, v1, v2
from t_nao_source
with (
    type = 'append-only',
    force_append_only='true'
);

# sinks to t_ao_npk
statement ok
create sink s1_to_t_ao_npk into t_ao_npk
as select k, v1, v2
from t_ao_source
with (
    type = 'append-only',
);

statement error Only append-only sinks can sink to a table without primary keys.
create sink s2_to_t_ao_npk into t_ao_npk
as select k, v1, v2
from t_nao_source;

statement ok
create sink s2_to_t_ao_npk into t_ao_npk
as select k, v1, v2
from t_nao_source
with (
    type = 'append-only',
    force_append_only='true'
);

# sinks to t_nao_pk
statement ok
create sink s1_to_t_nao_pk into t_nao_pk
as select k, v1, v2
from t_ao_source
with (
    type = 'append-only',
);

statement ok
create sink s2_to_t_nao_pk into t_nao_pk
as select k*10 as k, v1, v2
from t_nao_source;

statement ok
create sink s3_to_t_nao_pk into t_nao_pk
as select k*100 as k, v1, v2
from t_nao_source
with (
    type = 'append-only',
    force_append_only='true'
);

statement ok
insert into t_ao_source values (1, 10, 100);


query III rowsort
SELECT * FROM t_nao_npk;
----
1	10	100

query III rowsort
SELECT * FROM t_ao_npk;
----
1	10	100

query III rowsort
SELECT * FROM t_nao_pk;
----
1	10	100


statement ok
insert into t_nao_source values (2, 20, 200);


query III rowsort
SELECT * FROM t_nao_npk;
----
1	10	100
2	20	200

query III rowsort
SELECT * FROM t_ao_npk;
----
1	10	100
2	20	200

query III rowsort
SELECT * FROM t_nao_pk;
----
1	10	100
20	20	200
200	20	200

statement ok
update t_nao_source set v2 = 1000 where v1 = 20;

query III rowsort
SELECT * FROM t_nao_npk;
----
1	10	100
2	20	1000
2	20	200

query III rowsort
SELECT * FROM t_ao_npk;
----
1	10	100
2	20	1000
2	20	200

query III rowsort
SELECT * FROM t_nao_pk;
----
1	10	100
20	20	1000
200	20	1000

statement ok
delete from t_nao_source where v1 = 20;

query III rowsort
SELECT * FROM t_nao_npk;
----
1	10	100
2	20	1000
2	20	200

query III rowsort
SELECT * FROM t_ao_npk;
----
1	10	100
2	20	1000
2	20	200

query III rowsort
SELECT * FROM t_nao_pk;
----
1	10	100
200	20	1000


statement ok
drop sink s3_to_t_nao_pk;

statement ok
drop sink s2_to_t_nao_pk;

statement ok
drop sink s1_to_t_nao_pk;

statement ok
drop sink s2_to_t_ao_npk;

statement ok
drop sink s1_to_t_ao_npk;

statement ok
drop sink s2_to_t_nao_npk;

statement ok
drop sink s1_to_t_nao_npk;

statement ok
drop table t_ao_source

statement ok
drop table t_nao_npk

statement ok
drop table t_ao_npk

statement ok
drop table t_nao_source

statement ok
drop table t_nao_pk
