statement ok
SET RW_IMPLICIT_FLUSH TO true;

statement ok
create table t (v1 real not null, v2 int not null);

# Insert

statement ok
insert into t values (114, 10), (514, 20);

query RI
select v1, v2 from t order by v2;
----
114 10
514 20

statement ok
insert into t values (810, 40), (1919, 30);

query RI
select v1, v2 from t order by v2;
----
114 10
514 20
1919 30
810 40

# Delete

statement ok
delete from t where v1 = 1919;

query RI
select v1, v2 from t order by v2;
----
114 10
514 20
810 40

query I
select count(*) from t;
----
3

query I rowsort
select count(*), v1 from t group by v1;
----
1 810
1 514
1 114

statement ok
delete from t;

query RI
select v1, v2 from t order by v2;
----

query I
select count(*) from t;
----
0

statement ok
drop table t;
