statement ok
SET RW_IMPLICIT_FLUSH TO true;

statement ok
create table t1 (v1 int, v2 int);

statement ok
create index idx1 on t1(v1) include(v2);

statement ok
create index idx2 on t1(v2);

statement ok
insert into t1 values (1, 2), (3, 4), (5, 6);

statement ok
explain select v1, v2 from t1 where v1 = 1;

query II
select v1, v2 from t1 where v1 = 1;
----
1 2

query II
select v1, v2 from t1 where v2 = 4;
----
3 4

query II
select v1, v2 from t1 where v1 = 1 or v2 = 4 order by v1, v2;
----
1 2
3 4

statement ok
delete from t1 where v1 = 1;

query II
select v1, v2 from t1 order by v1, v2;
----
3 4
5 6

statement ok
insert into t1 values (NULL, 5);

statement ok
create index idx3 on t1(v1 desc);

statement ok
create index idx4 on t1(v1 nulls first);

statement ok
create index idx5 on t1(v1 desc nulls last);

query II
select v1, v2 from t1 order by v1;
----
3    4
5    6
NULL 5

query II
select v1, v2 from t1 order by v1 desc;
----
NULL 5
5    6
3    4

query II
select v1, v2 from t1 order by v1 asc nulls first;
----
NULL 5
3    4
5    6

query II
select v1, v2 from t1 order by v1 desc nulls last;
----
5    6
3    4
NULL 5

query II
select v1, v2 from t1 order by v1 desc nulls first;
----
NULL 5
5    6
3    4

statement ok
drop table t1;

# create functional indexes
statement ok

create table t (v1 varchar, v2 varchar);

statement ok
insert into t values ('Hello', 'World');

statement ok
create index idx on t(lower(v1));

# functional indexes selection
query II
select * from t where lower(v1) = 'hello';
----
Hello World

statement ok
drop table t;

# indexes on expressions
statement ok
create table people (first_name varchar, last_name varchar, info varchar);

statement ok
create index people_names ON people ((first_name || ' ' || last_name));

statement ok
insert into people values ('John', 'Smith', 'test'), ('Dylan', 'Chen', 'test');

query TTT
select * from people where (first_name || ' ' || last_name) = 'John Smith';;
----
John Smith test

statement ok
drop table people;
