statement ok
SET RW_IMPLICIT_FLUSH TO true;

statement ok
create table t (v1 int);

statement ok
insert into t values (10), (20), (30);

statement ok
create table t1 (v1 int, v2 int);

statement ok
insert into t1 (v1) values (1), (2);

query I rowsort
select * from t1;
----
1 NULL
2 NULL

statement ok
insert into t1 (v2) values (1), (2);

query I rowsort
select * from t1;
----
1 NULL
2 NULL
NULL 1
NULL 2

statement ok
insert into t1 select * from t;

query I rowsort
select * from t1;
----
1 NULL
10 NULL
2 NULL
20 NULL
30 NULL
NULL 1
NULL 2

statement ok
insert into t1 (v2) select * from t;

query I rowsort
select * from t1;
----
1 NULL
10 NULL
2 NULL
20 NULL
30 NULL
NULL 1
NULL 10
NULL 2
NULL 20
NULL 30

statement error
insert into t1 (v1, v2) select * from t;

statement error
insert into t1 (v1, v2) values (1);

statement error
insert into t1 (v1, v2) values (1, 2, 3);

statement ok
delete from t1;

statement ok
insert into t1 (v2, v1) values (2, 1);

query I rowsort
select * from t1;
----
1 2

statement ok
insert into t1 (v2, v1) select * from t1;

query I rowsort
select * from t1;
----
1 2
2 1

statement ok
drop table t1;

statement ok
drop table t;
