statement ok
SET RW_IMPLICIT_FLUSH TO true;

statement ok
create table t (v1 int);

statement ok
insert into t values (3);

query I rowsort
select * from t;
----
3

# currently returning tests are blocked by https://github.com/risingwavelabs/risingwave/issues/7277
# query I
# insert into t values (2+2) returning *;
# ----
# 4

statement ok
insert into t values (2+2);

query I rowsort
select * from t;
----
3
4

statement ok
insert into t values (7), (8), (9);

query I rowsort
select * from t;
----
3
4
7
8
9

statement ok
insert into t values (2+3), (2+4), (3+4);

query I rowsort
select * from t;
----
3
4
5
6
7
7
8
9

statement ok
insert into t values (12), (6+7), (44);

query I rowsort
select * from t;
----
12
13
3
4
44
5
6
7
7
8
9

# query I
# update t set v1=v1+2 where v1=3 returning *;
# ----
# 5

# query II
# delete from t where v1=5 returning *,2*v1;
# ----
# 5 10

statement ok
drop table t;

# test inserts with defined columns

statement ok
create table t (v1 int, v2 int, v3 int);

statement ok
insert into t (v1, v3, v2) values (1, 2, 3);

query I rowsort
select * from t;
----
1 3 2

statement ok
insert into t (v1, v2, v3) values (1, 2, 3);

query I rowsort
select * from t;
----
1	2	3
1	3	2

statement ok
insert into t (v2, v1, v3) values (1, 2, 3);

query I rowsort
select * from t;
----
1	2	3
1	3	2
2	1	3

statement ok
insert into t (v2, v3, v1) values (1, 2, 3);

query I rowsort
select * from t;
----
1	2	3
1	3	2
2	1	3
3	1	2

statement ok
insert into t (v3, v1, v2) values (1, 2, 3);

query I rowsort
select * from t;
----
1	2	3
1	3	2
2	1	3
2	3	1
3	1	2

statement ok
insert into t (v3, v2, v1) values (1, 2, 3);

query I rowsort
select * from t;
----
1	2	3
1	3	2
2	1	3
2	3	1
3	1	2
3	2	1

# column and table names have to be case insensitive

statement ok
drop table t;

# Bug https://github.com/risingwavelabs/risingwave/issues/6542
# Test all permutations

statement ok
create table t (v1 int, v2 int, v3 int, v4 int);

statement ok
insert into t (v1, v2, v3, v4) values (1, 2, 3, 4);

statement ok
insert into t (v1, v2, v4, v3) values (1, 2, 4, 3);

statement ok
insert into t (v1, v3, v2, v4) values (1, 3, 2, 4);

statement ok
insert into t (v1, v3, v4, v2) values (1, 3, 4, 2);

statement ok
insert into t (v1, v4, v2, v3) values (1, 4, 2, 3);

statement ok
insert into t (v1, v4, v3, v2) values (1, 4, 3, 2);

statement ok
insert into t (v2, v1, v3, v4) values (2, 1, 3, 4);

statement ok
insert into t (v2, v1, v4, v3) values (2, 1, 4, 3);

statement ok
insert into t (v2, v3, v1, v4) values (2, 3, 1, 4);

statement ok
insert into t (v2, v3, v4, v1) values (2, 3, 4, 1);

statement ok
insert into t (v2, v4, v1, v3) values (2, 4, 1, 3);

statement ok
insert into t (v2, v4, v3, v1) values (2, 4, 3, 1);

statement ok
insert into t (v3, v1, v2, v4) values (3, 1, 2, 4);

statement ok
insert into t (v3, v1, v4, v2) values (3, 1, 4, 2);

statement ok
insert into t (v3, v2, v1, v4) values (3, 2, 1, 4);

statement ok
insert into t (v3, v2, v4, v1) values (3, 2, 4, 1);

statement ok
insert into t (v3, v4, v1, v2) values (3, 4, 1, 2);

statement ok
insert into t (v3, v4, v2, v1) values (3, 4, 2, 1);

statement ok
insert into t (v4, v1, v2, v3) values (4, 1, 2, 3);

statement ok
insert into t (v4, v1, v3, v2) values (4, 1, 3, 2);

statement ok
insert into t (v4, v2, v1, v3) values (4, 2, 1, 3);

statement ok
insert into t (v4, v2, v3, v1) values (4, 2, 3, 1);

statement ok
insert into t (v4, v3, v1, v2) values (4, 3, 1, 2);

statement ok
insert into t (v4, v3, v2, v1) values (4, 3, 2, 1);

query I rowsort
select * from t;
----
1 2 3 4
1 2 3 4
1 2 3 4
1 2 3 4
1 2 3 4
1 2 3 4
1 2 3 4
1 2 3 4
1 2 3 4
1 2 3 4
1 2 3 4
1 2 3 4
1 2 3 4
1 2 3 4
1 2 3 4
1 2 3 4
1 2 3 4
1 2 3 4
1 2 3 4
1 2 3 4
1 2 3 4
1 2 3 4
1 2 3 4
1 2 3 4

statement ok
drop table t;



statement ok
create table t (v1 int, v2 int, v3 int);

statement ok
insert into T (V1, v3, v2) values (1, 2, 3);

query I rowsort
select * from T;
----
1 3 2

query I rowsort
select * from t;
----
1 3 2

statement ok
drop table t;
