statement ok
SET RW_IMPLICIT_FLUSH TO true;

statement ok
create table t (v1 real, v2 int);

# Insert

statement ok
insert into t values (114, 10), (514, 20);

query RI
select v1, v2 from t order by v2;
----
114 10
514 20

statement ok
insert into t values (810, 40), (1919, 30);

query RI
select v1, v2 from t order by v2;
----
114 10
514 20
1919 30
810 40

# Update

statement ok
update t set (v1, v2) = (v2 + 5, v1) where v1 >= 810;

query RI
select v1, v2 from t order by v2;
----
114 10
514 20
45 810
35 1919

# Delete

statement ok
delete from t where v2 = 810;

query RI
select v1, v2 from t order by v2;
----
114 10
514 20
35 1919

query I
select count(*) from t;
----
3

statement ok
delete from t;

query RI
select v1, v2 from t order by v2;
----

query I
select count(*) from t;
----
0

statement ok
drop table t;
