statement ok
SET RW_IMPLICIT_FLUSH TO true;

statement ok
create table t1 (v1 int, v2 int default 2+3);

statement ok
insert into t1 values (0, 0);

query II
select * from t1;
----
0 0

statement ok
insert into t1 values (1);

query II
select * from t1 where v1 = 1;
----
1 5

statement ok
update t1 set v2 = default where v1 = 0;

query II
select * from t1 where v1 = 0;
----
0 5

statement ok
drop table t1;
