statement ok
SET RW_IMPLICIT_FLUSH TO true;

statement ok
create table t1 (v1 int, v2 int default 2+3);

statement ok
insert into t1 values (0, 0);

query II
select * from t1;
----
0 0

statement ok
insert into t1 values (1);

query II
select * from t1 where v1 = 1;
----
1 5

statement ok
update t1 set v2 = default where v1 = 0;

query II
select * from t1 where v1 = 0;
----
0 5

statement error
update t1 set (v1, v2) = (0, default);

statement ok
create table t2 (v1 int, v2 int default 1.5);

statement ok
insert into t2 values (1), (2);

query II
select * from t2;
----
1 2
2 2

statement ok
drop table t1;

statement ok
drop table t2;
