statement ok
SET RW_IMPLICIT_FLUSH TO true;

statement ok
create table t1 (v1 int, v2 int default 2+3);

statement ok
insert into t1 values (0, 0);

query II
select * from t1;
----
0 0

statement ok
insert into t1 values (1);

query II
select * from t1 where v1 = 1;
----
1 5

statement ok
update t1 set v2 = default where v1 = 0;

query II
select * from t1 where v1 = 0;
----
0 5

statement error
update t1 set (v1, v2) = (0, default);

statement ok
alter table t1 add column v3 int default 3;

query III rowsort
select * from t1;
----
0 5 3
1 5 3

statement ok
insert into t1 values (233, 233, null);

query III rowsort
select * from t1;
----
0 5 3
1 5 3
233 233 NULL

statement ok
alter table t1 add column v4 int default 4;

query IIII rowsort
select * from t1;
----
0 5 3 4
1 5 3 4
233 233 NULL 4

statement ok
create table t2 (v1 int, v2 int default 1.5);

statement ok
insert into t2 values (1), (2);

query II
select * from t2;
----
1 2
2 2

statement ok
create table tt (v1 int, v2 timestamptz default now());

statement ok
insert into tt values (1);

query II
select v1, v2 >= date '2021-01-01' from tt;
----
1 t

statement ok
update tt set v2=default;

statement ok
drop table t1;

statement ok
drop table t2;

statement ok
drop table tt;
