statement ok
SET RW_IMPLICIT_FLUSH TO true;

statement ok
create table t (v boolean);

statement ok
create materialized view mv as select
    bool_and(v),
    bool_or(v)
from t;

query BB
select * from mv;
----
NULL NULL


statement ok
insert into t values (true);

# table values: true

query BB
select * from mv;
----
t t


statement ok
insert into t values (false);

# table values: true, false

query BB
select * from mv;
----
f t


statement ok
delete from t where v = true;

# table values: false

query BB
select * from mv;
----
f f


statement ok
delete from t;

# table values: empty

query BB
select * from mv;
----
NULL NULL


statement ok
drop materialized view mv;

statement ok
drop table t;
