# Single phase approx percentile
statement ok
create table t(p_col double, grp_col int);

statement ok
insert into t select a, 1 from generate_series(-1000, 1000) t(a);

statement ok
flush;

query I
 select
     approx_percentile(0.01, 0.01) within group (order by p_col) as p01,
     approx_percentile(0.1, 0.01) within group (order by p_col) as p10,
     approx_percentile(0.5, 0.01) within group (order by p_col) as p50,
     approx_percentile(0.9, 0.01) within group (order by p_col) as p90,
     approx_percentile(0.99, 0.01) within group (order by p_col) as p99
 from t group by grp_col;
----
-982.5779489474152 -804.4614206837127 0 804.4614206837127 982.5779489474152

query I
select
  percentile_disc(0.01) within group (order by p_col) as p01,
  percentile_disc(0.1) within group (order by p_col) as p10,
  percentile_disc(0.5) within group (order by p_col) as p50,
  percentile_disc(0.9) within group (order by p_col) as p90,
  percentile_disc(0.99) within group (order by p_col) as p99
from t group by grp_col;
----
-980 -800 0 800 980

statement ok
create materialized view m1 as
 select
     approx_percentile(0.01, 0.01) within group (order by p_col) as p01,
     approx_percentile(0.1, 0.01) within group (order by p_col) as p10,
     approx_percentile(0.5, 0.01) within group (order by p_col) as p50,
     approx_percentile(0.9, 0.01) within group (order by p_col) as p90,
     approx_percentile(0.99, 0.01) within group (order by p_col) as p99
 from t group by grp_col;

query I
select * from m1;
----
-982.5779489474152 -804.4614206837127 0 804.4614206837127 982.5779489474152

# Test state encode / decode
onlyif can-use-recover
statement ok
recover;

onlyif can-use-recover

query I retry 11 backoff 1s
select * from m1;
----
-982.5779489474152 -804.4614206837127 0 804.4614206837127 982.5779489474152

# Test 0<x<1 values
statement ok
insert into t select 0.001, 1 from generate_series(1, 500);

statement ok
insert into t select 0.0001, 1 from generate_series(1, 501);

statement ok
flush;

query I
select * from m1;
----
-963.1209598593477 -699.3618972397041 0.00009999833511933609 699.3618972397041 963.1209598593477

query I
select
  percentile_disc(0.01) within group (order by p_col) as p01,
  percentile_disc(0.1) within group (order by p_col) as p10,
  percentile_disc(0.5) within group (order by p_col) as p50,
  percentile_disc(0.9) within group (order by p_col) as p90,
  percentile_disc(0.99) within group (order by p_col) as p99
from t group by grp_col;
----
-970 -700 0.0001 700 970

statement ok
delete from t;

statement ok
insert into t select 0.0001, 1 from generate_series(1, 501);

statement ok
flush;

query I
select
 round(p01::numeric, 6) as p01,
 round(p10::numeric, 6) as p10,
 round(p50::numeric, 6) as p50,
 round(p90::numeric, 6) as p90,
 round(p99::numeric, 6) as p99
 from m1;
----
0.000100 0.000100 0.000100 0.000100 0.000100

statement ok
drop materialized view m1;

statement ok
drop table t;
